{
  "brief_hash": "ch802d08",
  "created_at": "2026-07-08T00:00:00+09:00",
  "brief": {
    "md_path": "C:/Users/PC-220627-03/Desktop/project/my/architecture-thinking/2학년_8차시(시간)_임상현.md",
    "title": "2학년_8차시(시간)_임상현",
    "user_request": "초등 2학년 학습자가 시간 개념을 쉽게 이해할 수 있는 밝고 게임적인 도서관 수리 모험 콘텐츠로 구성한다. 스토리보드 원문과 예시 화면을 우선 반영한다."
  },
  "metadata": {
    "description": "2학년 8차시 시간 콘텐츠 run을 생성하기 위한 story board 입력"
  }
}
