{
  "brief_hash": "7c829ae6",
  "created_at": "2026-08-19T16:12:06+09:00",
  "brief": {
    "md_path": "C:/Users/PC-220627-03/Desktop/project/my/architecture-thinking/2학년_8차시(시간)_임상현_interviewed.md",
    "title": "시간이 뒤죽박죽! 수학의 힘으로 도서관 시계를 수리하라!",
    "user_request": "스토리보드 원문을 요약하거나 생략하지 않고 활동 1~3의 모든 씬과 12문제를 구현한다. 각 표에서 뒤쪽에 놓인 행(화면 연출, 문제 교체 연출, 오답 반복 처리, 정답 피드백, 범위 제외 등)도 앞쪽 행과 같은 비중으로 반영한다. 뒤에 있다고 부차적인 것이 아니다. 공간적 배경은 마을 도서관이고 등장인물은 사서 선생님(성인 여성)과 꼬마 사서(어린이)다."
  },
  "metadata": {
    "components": [
      "topbar",
      "scene-controller",
      "debug-jumper",
      "speech-bubble",
      "keypad",
      "ticket-button"
    ],
    "source_sha256": "7c829ae61e4454d6d8efc5442302d5710514317e1144bbc3256f863ffa9d9c7c",
    "style_reference_set": {
      "id": "baek-seungyong-basic",
      "must_follow": true,
      "root": "source/baek-seungyong",
      "usage_policy": {
        "summary": "이미지를 직접 열어 확인하고 description보다 reference image를 우선한다. 항목별 use/avoid는 catalog가 소유한다."
      }
    }
  }
}
