{
  "brief_hash": "65126dad",
  "created_at": "2026-08-11T14:00:00.0000000+09:00",
  "brief": {
    "md_path": "C:/Users/PC-220627-03/Desktop/project/my/architecture-thinking/2학년_8차시(시간)_임상현.md",
    "title": "2학년 8차시 (시간) 임상현 — 시간이 뒤죽박죽! 수학의 힘으로 도서관 시계를 수리하라!",
    "user_request": "Markdown 원문을 요약하거나 수정하지 않고 모두 구현한다. 이미지와 화면 UI는 STYLE_REFERENCE_SET_JSON의 백승용 화풍을 반드시 따른다. 이 차시의 공간은 마을 도서관이고 등장인물은 사서 선생님(성인 여성)과 꼬마 사서(어린이)다."
  },
  "metadata": {
    "components": [
      "topbar",
      "scene-controller",
      "debug-jumper",
      "feedback-layer",
      "ticket-button",
      "keypad",
      "speech-bubble"
    ],
    "source_sha256": "65126dad10c6f489bc12bfc689a0a08664a63f54f72ccda404dbc75fafe3713b",
    "style_reference_set": {
      "id": "baek-seungyong-basic",
      "must_follow": true,
      "root": "source/baek-seungyong",
      "usage_policy": {
        "summary": "이미지를 직접 열어 확인하고 description보다 reference image를 우선한다. 항목별 use/avoid는 source/baek-seungyong의 md catalog가 소유한다."
      }
    }
  }
}
