{
  "brief_hash": "dfbc1027",
  "created_at": "2026-07-31T11:19:21.4427984+09:00",
  "brief": {
    "md_path": "C:/Users/PC-220627-03/Desktop/project/my/architecture-thinking/수리력 1차_1학년 2학기 8차시 (백승용) 723 요청.md",
    "title": "수리력 1차_1학년 2학기 8차시 (백승용) 723 요청",
    "user_request": "Markdown 원문을 요약하거나 수정하지 않고 모두 구현한다. 이미지와 화면 UI는 STYLE_REFERENCE_SET_JSON의 gyo6 1-2-01 style2 화풍을 반드시 따른다. 참조 이미지의 기존 인물 정체성, 문구, 학습 주제는 복제하지 않는다."
  },
  "metadata": {
    "source_sha256": "dfbc10274c8f1cc8cb5b1c77e1ef44019a584031964ba16f32cd205b0442b31a",
    "style_reference_set": {
      "id": "gyo6-1-2-01-style2",
      "must_follow": true,
      "root": "style-references/gyo6_1-2_01",
      "usage_policy": {
        "canonical_cluster": "밝고 선명한 저학년 교육용 애니메이션 style2 묶음만 사용",
        "selection": "생성 자산의 범주에 맞는 참조 2~3개만 전달하고 전체 참조를 한 호출에 몰아넣지 않음",
        "identity": "캐릭터 참조는 선, 비율, 명암, 표정 표현만 사용하고 얼굴, 머리, 의상, 이름은 복제하지 않음",
        "content": "참조 속 문구, 학습 내용, 놀이터와 수리 보드 주제 및 구도는 복제하지 않음",
        "cta": "CTA 참조는 형태, 테두리, 그림자, 위계, 상태 표현만 사용하고 라벨 문구는 복제하지 않음"
      },
      "categories": {
        "backgrounds": [
          {
            "path": "backgrounds/playground-peaceful.webp",
            "role": "밝은 낮 배경의 기준 팔레트",
            "use": "맑은 하늘, 부드러운 원경, 저학년용 밝은 채도, 단순한 셀 명암",
            "avoid": "놀이터 장면과 인물 배치 자체를 복제하지 않음"
          },
          {
            "path": "backgrounds/playground-board-flip-action-style2.webp",
            "role": "행동 장면의 공간감과 선명도 기준",
            "use": "전경·중경·원경 분리, 선명한 중간 굵기 선, 따뜻한 햇빛",
            "avoid": "기존 수리 보드와 액션 구도를 복제하지 않음"
          },
          {
            "path": "backgrounds/playground-ball-throw-action-style2.webp",
            "role": "동적 장면의 색과 조명 기준",
            "use": "밝은 원색 포인트, 깨끗한 외곽선, 활기 있는 저학년 분위기",
            "avoid": "공 던지기 사건과 캐릭터 구도를 복제하지 않음"
          }
        ],
        "characters": [
          {
            "path": "characters/idle.webp",
            "role": "기본 자세 캐릭터 화풍 기준",
            "use": "둥근 얼굴, 깨끗한 중간 굵기 선, 단순한 셀 명암, 친근한 비율",
            "avoid": "얼굴, 헤어, 운동복, 색 배합 등 기존 인물 정체성을 복제하지 않음"
          },
          {
            "path": "characters/thinking.webp",
            "role": "생각하는 표정과 포즈 언어 기준",
            "use": "표정 가독성, 손동작, 눈썹과 시선의 명확한 감정 전달",
            "avoid": "기존 인물의 외형과 자세를 그대로 베끼지 않음"
          },
          {
            "path": "characters/praising.webp",
            "role": "긍정 피드백 표정과 동작 기준",
            "use": "과장되지만 부드러운 저학년용 표정, 자연스러운 팔다리 곡선",
            "avoid": "기존 인물의 외형과 운동회 맥락을 복제하지 않음"
          }
        ],
        "props": [
          {
            "path": "props/repair-board-blue-broken.webp",
            "role": "장면 속 조작 소품의 재질 기준",
            "use": "둥근 외곽, 단순한 입체감, 파란 몸체와 명확한 조작 영역",
            "avoid": "수리 보드의 기능과 형태를 새 콘텐츠에 그대로 복제하지 않음"
          },
          {
            "path": "props/repair-stamp.webp",
            "role": "피드백 소품의 촉감과 선 기준",
            "use": "손에 잡히는 둥근 형태, 선명한 외곽선, 짧은 셀 명암",
            "avoid": "도장 문구나 기존 보상 의미를 복제하지 않음"
          },
          {
            "path": "props/finger-tap-button.webp",
            "role": "누를 수 있는 조작물의 가독성 기준",
            "use": "큰 실루엣, 명확한 접촉 지점, 저학년이 이해하기 쉬운 입체감",
            "avoid": "기존 손 모양과 버튼 구도를 필수 구성으로 복제하지 않음"
          }
        ],
        "ctas": [
          {
            "path": "ctas/cta-intro.webp",
            "role": "도입 CTA의 기본·hover·pressed 기준",
            "use": "흰색 몸체, 파란 테두리, 둥근 실루엣, 분명한 눌림 깊이",
            "avoid": "스크린샷 안의 제목, 설명, 버튼 라벨을 복제하지 않음"
          },
          {
            "path": "ctas/cta-activity.webp",
            "role": "활동 전환 CTA의 상태 기준",
            "use": "크림색 몸체, 갈색 테두리, 따뜻한 강조, hover와 pressed 차이",
            "avoid": "스크린샷 안의 제목, 설명, 버튼 라벨을 복제하지 않음"
          },
          {
            "path": "ctas/cta-primary-secondary.webp",
            "role": "선택·완료 CTA 위계 기준",
            "use": "형태는 통일하고 파란 primary와 밝은 secondary의 색 대비로 위계 구분",
            "avoid": "스크린샷 안의 제목, 설명, 버튼 라벨을 복제하지 않음"
          }
        ]
      }
    }
  }
}
