{
  "brief_hash": "a1b2c3d4",
  "created_at": "2026-06-17T16:45:00+09:00",
  "brief": {
    "md_path": "../콘텐츠 기획_SB_임상현.md",
    "title": "콘텐츠 기획_SB_임상현",
    "user_request": "초등 저학년 학습자가 바로 이해할 수 있는 밝고 게임적인 분위기로 구성한다."
  },
  "metadata": {
    "description": "단일 HTML 콘텐츠 run을 생성하기 위한 story board 입력"
  }
}
