{
  "brief_hash": "dfbc1027",
  "created_at": "2026-08-12T15:40:09+09:00",
  "brief": {
    "md_path": "C:/Users/PC-220627-03/Desktop/project/my/architecture-thinking/수리력 1차_1학년 2학기 8차시 (백승용) 723 요청.md",
    "title": "수리력 1차_1학년 2학기 8차시 (백승용) 723 요청",
    "user_request": "초등 1학년이 모양 찾기와 색칠 활동으로 세 수의 덧셈·뺄셈을 익히도록 밝고 친근하게 구성한다."
  },
  "metadata": {
    "components": [
      "topbar",
      "scene-controller",
      "debug-jumper",
      "speech-bubble",
      "keypad",
      "ticket-button",
      "feedback-layer"
    ],
    "source_sha256": "dfbc10274c8f1cc8cb5b1c77e1ef44019a584031964ba16f32cd205b0442b31a",
    "style_reference_set": {
      "id": "baek-seungyong-basic",
      "must_follow": true,
      "root": "source/baek-seungyong",
      "usage_policy": {
        "summary": "이미지를 직접 열어 확인하고 description보다 reference image를 우선한다. 항목별 use/avoid는 source/baek-seungyong의 md catalog가 소유한다."
      }
    }
  }
}
