{
  "brief_hash": "9d851b54",
  "created_at": "2026-09-04T14:45:53+09:00",
  "brief": {
    "md_path": "C:/Users/PC-220627-03/Desktop/project/my/architecture-thinking/4학년_1차시(큰 수)_김효남.md",
    "title": "4학년 1차시 (큰 수) — 박물관에 숨은 큰 수를 찾아라!",
    "user_request": "스토리보드 원문을 요약하거나 생략하지 않고 슬라이드 1~8의 모든 화면과 문제를 구현한다. 공간적 배경은 경주 박물관(외부 전경 → 내부 전시실)이고 등장인물은 초등학생 아이(여자 어린이)와 큐레이터(성인)다. 상단 진행 네비게이션은 수리가 필요해요 / 수리로 해결해요 1~5 / 수리 이야기 8단계로 고정 노출한다. 태블릿에서도 읽히도록 본문 글자 크기를 키운다. 기획서에서 비어 있는 화면(슬라이드 3의 화면 4, 슬라이드 8의 화면 3~4)은 만들지 않는다."
  },
  "metadata": {
    "components": [
      "topbar",
      "scene-controller",
      "debug-jumper",
      "speech-bubble",
      "keypad",
      "ticket-button",
      "feedback-layer"
    ],
    "source_sha256": "9d851b54a925315a4c8933b66526a9b05e482585cbbdb35bca8917594cd72c96",
    "style_reference_set": {
      "id": "baek-seungyong-basic",
      "must_follow": true,
      "root": "source/baek-seungyong",
      "usage_policy": {
        "summary": "이미지를 직접 열어 확인하고 description보다 reference image를 우선한다. 항목별 use/avoid는 catalog가 소유한다."
      }
    }
  }
}
